{
  "event_id": "0190dt-0005",
  "timestamp": "2026-11-03T18:00:00Z",
  "kind": "defensetech.dfars.cyber-incident-flagged",
  "source": "stratos-soc-prod",
  "subject_ref": {
    "scheme": "cage-code-tokenized",
    "value": "tok_cage_STRATOS_AERO_1A2B3"
  },
  "resource": {
    "type": "cui-spillage-event-log",
    "id_tokenized": "tok_res_spillage_e5",
    "cui_categorization": "CUI-BASIC",
    "export_control_status": "NOT-EXPORT-CONTROLLED",
    "foreign_person_access_restriction": "US-PERSON-ONLY"
  },
  "action": "stamp",
  "outcome": {
    "status": "serious-failure",
    "recommendation": "halt-and-escalate-to-fso"
  },
  "agent": {
    "ai_tool_card_url": "https://vendord-guardianai.example/.well-known/ai-tool-cards/guardianai-3.x.json",
    "ai_decision_card_url": "https://stratos-aerospace.example/.well-known/decisions/STRATOS-DEC-2026-DEF-0084.json",
    "human_user_clearance_level_tokenized": "tok_clr_SECRET",
    "human_user_us_person_status": "US-PERSON-VERIFIED"
  },
  "regulatory_basis": [
    "dfars-252-204-7012-cyber-incident-reporting",
    "nist-sp-800-171-cui-protection"
  ],
  "dfars_cyber_incident_report_ref": {
    "report_id": "STRATOS-DFARS-2026-0011",
    "filed_at": "2026-11-04T15:30:00Z",
    "dibnet_dod_mil_url": "https://dibnet.dod.mil/reports/STRATOS-DFARS-2026-0011"
  },
  "decision_card_ref": "https://stratos-aerospace.example/.well-known/decisions/STRATOS-DEC-2026-DEF-0084.json",
  "prev_hash": "9b325ec8bd51bcc5284f7bd8758e2c6ec4aeb7618fcb91520fd757e45f3f3432",
  "hash": "4548ee81d51e4a93eeb1b09b639ab58d52dc66d08b70d426c7e613713e7ff270"
}
