{
  "event_id": "0190dt-0001",
  "timestamp": "2026-11-03T14:00:00Z",
  "kind": "defensetech.rfp.requirement-analyzed",
  "source": "stratos-cui-enclave-prod",
  "subject_ref": {
    "scheme": "rfp-solicitation-number-tokenized",
    "value": "tok_rfp_AF_RFP_2027_001"
  },
  "resource": {
    "type": "rfp-solicitation-document",
    "id_tokenized": "tok_res_rfp_a1",
    "cui_categorization": "CUI-BASIC",
    "export_control_status": "NOT-EXPORT-CONTROLLED",
    "foreign_person_access_restriction": "US-PERSON-ONLY"
  },
  "action": "read",
  "outcome": {
    "status": "success",
    "recommendation": "advisory-only"
  },
  "agent": {
    "ai_tool_card_url": "https://vendord-guardianai.example/.well-known/ai-tool-cards/guardianai-3.x.json",
    "ai_decision_card_url": "https://stratos-aerospace.example/.well-known/decisions/STRATOS-DEC-2026-DEF-0084.json",
    "human_user_clearance_level_tokenized": "tok_clr_UNCLASSIFIED",
    "human_user_us_person_status": "US-PERSON-VERIFIED"
  },
  "regulatory_basis": [
    "dfars-252-204-7012-cdi-safeguarding",
    "nist-sp-800-171-cui-protection",
    "cui-notice-2020-04-implementation"
  ],
  "decision_card_ref": "https://stratos-aerospace.example/.well-known/decisions/STRATOS-DEC-2026-DEF-0084.json",
  "prev_hash": "0000000000000000000000000000000000000000000000000000000000000000",
  "hash": "59b29453aaa68ce4719dea5b162525d77dc08b285f4a13aafeba7ca5143e9308"
}
