{
  "event_id": "0190dt-0003",
  "timestamp": "2026-11-03T16:45:00Z",
  "kind": "defensetech.weapon-system.design-trade-evaluated",
  "source": "stratos-design-analytics-prod",
  "subject_ref": {
    "scheme": "weapon-system-program-id-tokenized",
    "value": "tok_prog_NextGen_AAM_2027"
  },
  "resource": {
    "type": "weapon-system-design-document",
    "id_tokenized": "tok_res_wsd_c3",
    "cui_categorization": "CUI-SPECIFIED-NOFORN",
    "export_control_status": "ITAR",
    "foreign_person_access_restriction": "US-PERSON-ONLY"
  },
  "action": "generate",
  "outcome": {
    "status": "success",
    "recommendation": "halt-and-escalate-to-empowered-official"
  },
  "agent": {
    "ai_tool_card_url": "https://vendord-guardianai.example/.well-known/ai-tool-cards/guardianai-3.x.json",
    "ai_decision_card_url": "https://stratos-aerospace.example/.well-known/decisions/STRATOS-DEC-2026-DEF-0084.json",
    "human_user_clearance_level_tokenized": "tok_clr_SECRET",
    "human_user_us_person_status": "US-PERSON-VERIFIED",
    "fso_session_id_tokenized": "tok_fso_session_5e7"
  },
  "regulatory_basis": [
    "itar-22-cfr-120-130",
    "nist-sp-800-172-enhanced-security-requirements",
    "cui-notice-2020-04-implementation"
  ],
  "distribution_statement": {
    "statement_letter": "C",
    "applied_at": "2026-11-03T16:45:00Z",
    "rationale": "Distribution authorized to US Government agencies + their contractors only"
  },
  "decision_card_ref": "https://stratos-aerospace.example/.well-known/decisions/STRATOS-DEC-2026-DEF-0084.json",
  "prev_hash": "37318e5cb04125c1b06f998d84ba4499fdde309c6a2551efa982b4cb29472271",
  "hash": "f27197270c9ac5c0e9a67e01e4d848ded6c4ad5da75fe3931758c5c7dcc160b5"
}
