{
  "event_id": "0190dt-0006",
  "timestamp": "2026-11-04T10:00:00Z",
  "kind": "defensetech.cmmc.poam-update-recommended",
  "source": "stratos-cmmc-prod",
  "subject_ref": {
    "scheme": "cmmc-assessment-id-tokenized",
    "value": "tok_cmmc_STRATOS_L2_2026"
  },
  "resource": {
    "type": "cmmc-poam-record",
    "id_tokenized": "tok_res_poam_f6",
    "cui_categorization": "CUI-BASIC",
    "export_control_status": "NOT-EXPORT-CONTROLLED",
    "foreign_person_access_restriction": "US-PERSON-ONLY"
  },
  "action": "generate",
  "outcome": {
    "status": "success",
    "recommendation": "supervisor-review-required"
  },
  "agent": {
    "ai_tool_card_url": "https://vendord-guardianai.example/.well-known/ai-tool-cards/guardianai-3.x.json",
    "ai_decision_card_url": "https://stratos-aerospace.example/.well-known/decisions/STRATOS-DEC-2026-DEF-0084.json",
    "human_user_clearance_level_tokenized": "tok_clr_UNCLASSIFIED",
    "human_user_us_person_status": "US-PERSON-VERIFIED"
  },
  "regulatory_basis": [
    "cmmc-2-0-level-2-c3pao-assessment",
    "dfars-252-204-7021-cmmc-assessment-level-2-or-3",
    "nist-sp-800-171-cui-protection"
  ],
  "decision_card_ref": "https://stratos-aerospace.example/.well-known/decisions/STRATOS-DEC-2026-DEF-0084.json",
  "prev_hash": "4548ee81d51e4a93eeb1b09b639ab58d52dc66d08b70d426c7e613713e7ff270",
  "hash": "5d20eeedc0c8a140d647a3af4b3a171e2b03e1174e24a6fb768f22256573bf73"
}
